{
  "case_id": "SWESMITH_032",
  "odc_defect_type": "CHECKING",
  "taxonomy_fit": "DIRECT",
  "pattern_confidence": "HIGH",
  "supporting_evidence_ids": ["BUG_DIFF", "CODE_CONTEXT_01", "SPECIFICATION", "REFERENCE_REPAIR", "TEST_FAILURE_01", "TEST_FAILURE_02"],
  "reasoning_summary": "The address parser weakens validation by accepting port zero and addresses with extra colons; the repair restores the exact separator-count and valid-port-range checks."
}
