{
  "case_id": "SWESMITH_008",
  "odc_defect_type": "TIMING_SERIALIZATION",
  "taxonomy_fit": "DIRECT",
  "pattern_confidence": "HIGH",
  "supporting_evidence_ids": ["BUG_DIFF", "CODE_CONTEXT_01", "SPECIFICATION", "REFERENCE_REPAIR", "TEST_FAILURE_01", "TEST_FAILURE_02", "TEST_FAILURE_03"],
  "reasoning_summary": "The buggy finish sequence mishandles pending asynchronous writes and omits the read/write lifecycle ordering that disconnects an early-finished streaming request; the repair restores that ordering."
}
