{
  "case_id": "SWESMITH_023",
  "odc_defect_type": "ASSIGNMENT",
  "taxonomy_fit": "DIRECT",
  "pattern_confidence": "HIGH",
  "supporting_evidence_ids": ["BUG_DIFF", "CODE_CONTEXT_01", "REFERENCE_REPAIR", "TEST_FAILURE_01", "TEST_FAILURE_02", "TEST_FAILURE_03"],
  "reasoning_summary": "The buggy locale method returns relative_string before that local value is assigned, making the remaining formatting unreachable; the repair restores initialization before use and the final return."
}
