{
  "case_id": "SWESMITH_040",
  "odc_defect_type": "BUILD_PACKAGE_MERGE",
  "taxonomy_fit": "DIRECT",
  "pattern_confidence": "HIGH",
  "supporting_evidence_ids": ["BUG_DIFF", "CODE_CONTEXT_01", "SPECIFICATION", "REFERENCE_REPAIR", "TEST_FAILURE_01"],
  "reasoning_summary": "The system-package configuration omits supported distribution-to-manager mappings, causing Conan to choose incorrectly on Nobara and EndeavourOS; the repair restores package-manager configuration."
}
