{
  "case_id": "SWESMITH_095",
  "odc_defect_type": "ASSIGNMENT",
  "taxonomy_fit": "DIRECT",
  "pattern_confidence": "HIGH",
  "supporting_evidence_ids": [
    "BUG_DIFF",
    "CODE_CONTEXT_01",
    "REFERENCE_REPAIR",
    "TEST_FAILURE_01",
    "TEST_FAILURE_02",
    "TEST_FAILURE_03"
  ],
  "reasoning_summary": "The assignment that initializes rels_of_reltype is moved below an unconditional return, leaving the variable uninitialized when the preceding length checks execute. The resulting failure is directly caused by a missing/reordered value assignment."
}
