{
  "case_id": "SWESMITH_044",
  "odc_defect_type": "INTERFACE",
  "taxonomy_fit": "AMBIGUOUS",
  "pattern_confidence": "HIGH",
  "supporting_evidence_ids": ["BUG_DIFF", "CODE_CONTEXT_01", "SPECIFICATION", "REFERENCE_REPAIR", "TEST_FAILURE_01"],
  "reasoning_summary": "tokenFeatures emits a different feature-key and value schema from the one consumed by the address tagger, including broken Unicode normalization; that component contract takes precedence over the local extraction-algorithm aspect."
}
