{
  "case_id": "SWESMITH_041",
  "odc_defect_type": "ALGORITHM",
  "taxonomy_fit": "DIRECT",
  "pattern_confidence": "HIGH",
  "supporting_evidence_ids": ["BUG_DIFF", "CODE_CONTEXT_01", "SPECIFICATION", "REFERENCE_REPAIR", "TEST_FAILURE_01", "TEST_FAILURE_02", "TEST_FAILURE_03", "TEST_FAILURE_04"],
  "reasoning_summary": "The buggy patch application replaces equality scanning with an invalid slice-keyed lookup and fails to reconstruct insertions and replacements; the repair restores the source-rebuilding algorithm."
}
