{
  "case_id": "SWESMITH_012",
  "odc_defect_type": "ASSIGNMENT",
  "taxonomy_fit": "DIRECT",
  "pattern_confidence": "HIGH",
  "supporting_evidence_ids": ["BUG_DIFF", "CODE_CONTEXT_01", "REFERENCE_REPAIR", "TEST_FAILURE_01", "TEST_FAILURE_02", "TEST_FAILURE_03"],
  "reasoning_summary": "The buggy constructor assigns self.change_time before replacing a missing value with the current time, leaving the stored field incorrectly initialized; the repair moves the assignment after defaulting."
}
