{
  "case_id": "SWESMITH_071",
  "odc_defect_type": "INTERFACE",
  "taxonomy_fit": "AMBIGUOUS",
  "pattern_confidence": "HIGH",
  "supporting_evidence_ids": [
    "BUG_DIFF",
    "CODE_CONTEXT_01",
    "REFERENCE_REPAIR",
    "SPECIFICATION",
    "TEST_FAILURE_01",
    "TEST_FAILURE_02"
  ],
  "reasoning_summary": "The Optional constructor changes its accepted argument forwarding and the key representation used for default insertion, breaking established Optional and Literal caller behavior. The repair restores the prior constructor contract, default extraction, and normalized key. Assignment and validation aspects are also plausible, so the fit is ambiguous."
}
