{
  "case_id": "SWESMITH_009",
  "odc_defect_type": "ALGORITHM",
  "taxonomy_fit": "DIRECT",
  "pattern_confidence": "HIGH",
  "supporting_evidence_ids": ["BUG_DIFF", "CODE_CONTEXT_01", "SPECIFICATION", "REFERENCE_REPAIR", "TEST_FAILURE_01", "TEST_FAILURE_02"],
  "reasoning_summary": "The buggy inference flow passes the augmented operator to normal/reflected binary handling and orders fallbacks incorrectly; the repair restores the type-dependent operator-resolution algorithm."
}
