{
  "case_id": "SWESMITH_052",
  "odc_defect_type": "TIMING_SERIALIZATION",
  "taxonomy_fit": "DIRECT",
  "pattern_confidence": "HIGH",
  "supporting_evidence_ids": ["BUG_DIFF", "CODE_CONTEXT_01", "SPECIFICATION", "REFERENCE_REPAIR", "TEST_FAILURE_01", "TEST_FAILURE_03", "TEST_FAILURE_05"],
  "reasoning_summary": "The replacement parser misreads the serialized DICOM item/tag sequence and mishandles offset-table and fragment layouts; the repair restores the established encapsulated-data deserialization path."
}
